{"id":"s2","layout":"evidence","composition_id":"image-thesis-split","role":"problem","content_priority":"support","action_title":"只有固定 seed、OOD 评估和 A800，SSR 增益才有可比意义","audience_question":"哪些条件决定这组结果能否复现和外推？","narrative_job":"合并实验契约与泛化口径，明确训练 seed、OOD seed、机器人、领域随机化、GPU 条件及其复现限制。","slide_goal":"把后续所有数字锁定在明确的实验边界内。","primary_claim":"SFT 与 RL 使用同一组 1,000 个 RoboTwin 随机 seed，评估使用额外 128 个未见 seed，采用 Piper 双臂，并统一在 8 卡 A800 平台上运行。","evidence":[{"claim_support":"训练阶段使用 1,000 个随机场景 seed，评估阶段额外使用 128 个未参与训练的 OOD seed，并采用双臂 Piper 机械臂。","evidence_ref":"p1-snapshot","interpretation":"后续 SSR 主要检验受随机化场景与未见 seed 约束的行为表现，而不是单一固定布局上的成功率。"},{"claim_support":"RoboTwin 使用背景纹理、场景杂乱、光照、桌面高度和语言指令等领域随机化；相同 seed 集合在不同 Python、系统和硬件环境下可能无法完全复现，且观察到 H100 与 A800 的初始 SSR 差异。","evidence_ref":"p1-snapshot","interpretation":"复现时必须把运行环境和 GPU 视为实验变量，不能只复制 seed 数字。"}],"implication":"后续结论的有效范围是“固定 RoboTwin 配置、seed、评估口径和 8 卡 A800 条件下”，不是跨硬件、跨环境的普遍保证。","transition_in":"开场的归因问题首先需要一个稳定、可复现的比较边界。","transition_out":"边界确定后，还要看 RLinf 如何把 rollout 轨迹转换为更新信号。","evidence_refs":["p1-snapshot"],"table_refs":[],"asset_candidates":["p1-snapshot"],"visual_intent":"source_figure","visual_plan":{"layout_family":"evidence","primary_visual":"p1-snapshot","image_budget":1,"image_roles":["evidence"],"data_strategy":"source_figure","background_variant":"light","density":"balanced"},"speaker_notes":{"talk_track":"承接上一页的归因问题，这里先把比较边界锁定。SFT 与 RL 都在同一组 1,000 个 RoboTwin 随机 seed 上训练，使用双臂 Piper；评估则额外加入 128 个未见 seed，因此 SSR 反映的是随机化场景下的泛化，而非固定布局记忆。需要特别注意，背景、杂乱度、光照、桌高和语言都会随机变化，且 Python、系统和 GPU 差异会影响可用 seed 与初始 SSR，所以本文统一采用 8 卡 A800。后面讨论 RLinf 的增益时，都应在这个实验契约内理解。","delivery_cue":"先强调 1,000/128/8 卡三个数字，再指向右侧证据快照中的领域随机化与 GPU 说明；讲到“不是普遍保证”时停顿。","source_refs":["p1-snapshot"],"estimated_seconds":65},"content":{"eyebrow":null,"title":"SFT 与 RL 使用同一组 1,000 个 RoboTwin 随机 seed，评估使用额外 128 个未见 seed，采用 Piper 双臂，并统一在 8 卡 A800 平台上运行。","subtitle":null,"kicker":null,"lede":"这组结果只有在训练、评估与硬件条件同时对齐时，才具备可比性。","note":null,"body_points":[{"label":"训练对齐","text":"SFT 与 RL 共用 1,000 个随机场景 seed，并采用双臂 Piper 机械臂。"},{"label":"OOD 口径","text":"额外使用 128 个未见 seed，检验随机化场景下的外推，而不是固定布局上的记忆。"},{"label":"复现边界","text":"领域随机化与运行环境会改变可用 seed 和初始 SSR；因此统一锁定 8 卡 A800。"}],"metrics":[{"label":"训练 seed","value":"1,000","meaning":"SFT 与 RL 的共同场景起点"},{"label":"OOD seed","value":"128","meaning":"未参与训练的分布外评估"},{"label":"硬件条件","value":"8× A800","meaning":"后续 SSR 比较的固定平台"}],"steps":[],"result":null,"columns":[],"takeaway":{"label":"实验契约","value":"后续数字只在固定 RoboTwin 配置、seed、评估口径与 A800 条件下成立。"}}}