{"id":"s4","layout":"comparison","composition_id":"evidence-table","role":"limitations","content_priority":"core","action_title":"RLinf 与 SimpleVLA 共享基础，但不是同构训练对照","audience_question":"两套实现到底控制了哪些变量？","narrative_job":"并列呈现共同基础与关键差异，提前阻止把框架比较误读为纯算法消融。","slide_goal":"建立正确的因果解释边界，为后续平均增益比较提供必要前提。","primary_claim":"两套方法共享 SFT 模型、train/eval seeds、模型实现和 GRPO，但在精度、rollout batch、学习率、LoRA、valid trajectory 收集和 reward 粒度上存在差异。","evidence":[{"claim_support":"对比表列出 RLinf 使用 bf16、rollout batch 1024、learning rate 2.0e-4、LoRA，而 SimpleVLA 使用混合精度、rollout batch 512、learning rate 5e-6 和全参数训练。","evidence_ref":"p4-table-1-crop","interpretation":"这些变量会改变训练动态，因此最终差异属于完整训练系统差异，而不是单一算法开关。"},{"claim_support":"RLinf 固定轮次后过滤 collected trajectories，并采用 action-level reward；SimpleVLA 即时过滤并缓存轨迹，采用 token-level success reward。","evidence_ref":"p5-table-1-crop","interpretation":"有效轨迹数量和奖励传播位置不同，会改变每次更新接收到的学习信号。"}],"implication":"可以比较两套系统的实际结果，但不能据此单独证明 RLinf 的某个算法组件具有因果优势。","transition_in":"训练配方已经明确，公平性问题现在变成变量清单。","transition_out":"在保留这些差异的前提下，先看 RLinf 自身的跨任务收益是否成立。","evidence_refs":["p4-table-1-crop","p5-table-1-crop"],"table_refs":["p4-table-1","p5-table-1"],"asset_candidates":[],"visual_intent":"source_table","visual_plan":{"layout_family":"comparison","primary_visual":null,"image_budget":0,"image_roles":[],"data_strategy":"native_table","background_variant":"light","density":"dense"},"speaker_notes":{"talk_track":"承接上一页的训练配方，这里先把“公平比较”拆成变量清单。两套实现共享 SFT 模型、train/eval seeds、模型实现和 GRPO，因此有共同起点；但表中可见，RLinf 与 SimpleVLA 在精度、rollout batch、学习率和 LoRA 上并不相同。更关键的是，valid trajectory 的收集时机与 reward 粒度也不同，直接改变每次更新接收到的有效样本和学习信号。因此后面的结果可以作为系统级比较，但不能单独归因于某一个算法组件。接下来，在保留这些边界的前提下，看 RLinf 自身的跨任务收益。","delivery_cue":"先停在“共同基础”，再指向表中差异行；强调 1024 vs 512、2.0e-4 vs 5e-6，最后落到“系统级比较”的边界。","source_refs":["p4-table-1-crop","p5-table-1-crop","p4-table-1","p5-table-1"],"estimated_seconds":100},"content":{"eyebrow":null,"title":"两套方法共享 SFT 模型、train/eval seeds、模型实现和 GRPO，但在精度、rollout batch、学习率、LoRA、valid trajectory 收集和 reward 粒度上存在差异。","subtitle":null,"kicker":null,"lede":"先锁定共同起点，再拆解会改变训练动态与归因边界的差异。","note":{"label":"解释边界","value":"这是完整训练系统的实际比较，不是单一算法组件的因果消融。"},"body_points":[{"label":"共同基础","text":"SFT 模型、train/eval seeds、模型实现和 GRPO 保持一致；valid action mask 在工程上等价。"},{"label":"训练配方","text":"RLinf 使用 bf16、rollout bsz 1024、lr 2.0e-4、LoRA；SimpleVLA 为混合精度、512、5e-6、全参数训练。"},{"label":"学习信号","text":"RLinf 固定轮次后过滤 collected trajectories 并给 action-level reward；SimpleVLA 即时过滤、缓存轨迹并给 token-level success reward。"}],"metrics":[{"label":"rollout batch","value":"1024 vs 512","meaning":"每轮采样量不同"},{"label":"learning rate","value":"2.0e-4 vs 5e-6","meaning":"更新尺度相差 40×"},{"label":"reward 粒度","value":"action-level vs token-level","meaning":"奖励传播位置不同"}],"steps":[],"result":null,"columns":[{"label":"共享基础","headline":"同一比较起点","points":["SFT 模型","train/eval seeds","模型实现","GRPO"],"tone":"navy"},{"label":"关键差异","headline":"不是同构训练","points":["精度与 LoRA","rollout batch 与学习率","valid traj 收集","reward 粒度"],"tone":"coral"}],"takeaway":{"label":"页面结论","value":"共享基础不等于同构训练，后续结果应按系统级差异解读。"}}}