{"id":"s7","layout":"insight","composition_id":"answer-and-boundary","role":"limitations","content_priority":"core","action_title":"评估温度和初始模型会改变单点 SSR，不能脱离协议读数字","audience_question":"为什么同一任务的结果会随模型和温度变化？","narrative_job":"用 place_empty_cup 的 rebuttal 结果说明初始模型、评估温度、训练步数和是否重跑会影响可见 SSR。","slide_goal":"把单任务结果降级为敏感性证据，避免其承担普遍优越性结论。","primary_claim":"在 place_empty_cup 上，pi0 与 pi05 的 SFT 基线不同，OFT 在 Temp_eval=-1 与 1.6 下的 PPO/GRPO 结果也不同；部分温度结果未重跑，且 RL 结果统一取 50 step。","evidence":[{"claim_support":"表格列出 pi0/pi05 的 SFT、PPO、GRPO 结果，以及 OFT 在 Temp_eval=-1 和 Temp_eval=1.6 下的 PPO/GRPO 结果。","evidence_ref":"p1-table-1-crop","interpretation":"初始模型和采样温度会改变最终可见成功率，不能把单点数字直接当作方法独立能力。"},{"claim_support":"Temp_eval=1.6 下 place_empty_cup 的 PPO 为 86.72%，GRPO 为 88.28%；相关结果说明评估口径必须随数字一起报告。","evidence_ref":"p1-table-2-crop","interpretation":"评估温度是结果定义的一部分，复现或比较时需要固定并明确记录。"}],"implication":"跨任务平均结果应优先于单任务单温度结果；任何引用都应同时报告模型初始化、评估温度、训练步数和是否重跑。","transition_in":"框架级平均增益成立，但单点成绩揭示了结果对评估协议的敏感性。","transition_out":"性能判断之外，研究者还需要知道这套训练系统在实际运行时付出什么成本。","evidence_refs":["p1-table-1-crop","p1-table-2-crop"],"table_refs":["p1-table-1","p1-table-2"],"asset_candidates":[],"visual_intent":"source_table","visual_plan":{"layout_family":"insight","primary_visual":null,"image_budget":0,"image_roles":[],"data_strategy":"native_table","background_variant":"quiet","density":"balanced"},"speaker_notes":{"talk_track":"承接上一页的框架级平均增益，这里把视线收回到单任务 place_empty_cup，回答为什么同一任务会得到不同结果。表中 pi0 与 pi05 的 SFT 起点已明显不同，OFT 在 Temp_eval=-1 与 1.6 下的 PPO、GRPO 也随评估温度变化；其中部分温度结果没有重跑，RL 统一取 50 step。因此这些数字更适合作为敏感性证据，而不是方法独立能力。后续比较应优先看跨任务平均，并同时报告初始化、温度、步数与重跑状态。接下来转向训练系统的实际成本。","delivery_cue":"先停在两组 SFT 基线，再指向 OFT 两行的温度差异，强调 86.72% 与 88.28% 并非脱离评估口径的绝对数字。","source_refs":["p1-table-1-crop","p1-table-2-crop","p1-table-1","p1-table-2"],"estimated_seconds":100},"content":{"eyebrow":null,"title":"在 place_empty_cup 上，pi0 与 pi05 的 SFT 基线不同，OFT 在 Temp_eval=-1 与 1.6 下的 PPO/GRPO 结果也不同；部分温度结果未重跑，且 RL 结果统一取 50 step。","subtitle":null,"kicker":null,"lede":"同一任务的 SSR 不是只由 PPO/GRPO 决定；初始化、评估温度与实验口径都会改变可见结果。","note":{"label":"边界","value":"单任务、单温度结果只能支持敏感性判断，不能直接承担普遍优越性结论。"},"body_points":[{"label":"起点不同","text":"pi0 的 SFT 为 45.31%，pi05 为 85.16%；RL 增益不能脱离初始模型比较。"},{"label":"温度改变结果","text":"OFT 的 PPO/GRPO 在 Temp_eval=-1 与 1.6 下呈现不同 SSR，评估温度应随数字一并报告。"},{"label":"口径需固定","text":"相关温度结果部分未重跑，且 RL 结果统一取 50 step；复现时必须注明重跑状态与训练步数。"}],"metrics":[{"label":"pi0 → pi05 SFT","value":"45.31% → 85.16%","meaning":"初始模型本身带来显著不同的起点。"},{"label":"OFT · Temp_eval=1.6","value":"PPO 86.72%","meaning":"温度是结果定义的一部分。"},{"label":"OFT · Temp_eval=1.6","value":"GRPO 88.28%","meaning":"比较时必须固定评估协议。"}],"steps":[],"result":null,"columns":[],"takeaway":{"label":"因此","value":"跨任务平均结果优先于单任务单温度结果。"}}}