{"id":"s8","layout":"matrix","composition_id":"evidence-table","role":"main_results","content_priority":"core","action_title":"8 卡上 colocated 同时降低 actor 与 rollout 时间，其他模式呈现明确成本差异","audience_question":"实际运行 RLinf 时，哪种并行路径更值得选？","narrative_job":"比较 8 卡模式和 1/2/4 节点数据，把“更高效”拆成 actor 与 rollout 两个可测指标。","slide_goal":"将系统价值从抽象描述转化为具体的运行选择。","primary_claim":"8 卡数据中，RLinf colocated 的 actor/rollout 时间为 49.15/170.34 秒，SimpleVLA 为 94.05/189.33 秒；RLinf 的 disaggregated 与 hybrid 模式则显示出不同的时间成本。","evidence":[{"claim_support":"8 卡表列出 RLinf colocated、disaggregated、Hybrid(pipe=1)、Hybrid(pipe=2) 与 SimpleVLA 的 actor 和 rollout 时间。","evidence_ref":"p6-table-2-crop","interpretation":"在该测试条件下，colocated 的两个时间指标都低于 SimpleVLA 对应数据，而其他 RLinf 模式需要按具体成本选择。"},{"claim_support":"1、2、4 节点表列出 RLinf 各模式随节点数变化的 actor 与 generate 时间，另列出 SimpleVLA colocated 数据。","evidence_ref":"p8-table-1-crop","interpretation":"并行模式和节点数会改变运行成本，因此不存在脱离模式与规模的单一效率结论。"}],"implication":"部署判断应明确节点数、并行模式和测量指标；“RLinf 更快”只能具体化为某一配置下的 actor/rollout 时间优势。","transition_in":"敏感性分析限定了性能数字，系统表则限定了效率数字。","transition_out":"现在可以用性能、效率和归因边界共同回答开场问题。","evidence_refs":["p6-table-2-crop","p8-table-1-crop"],"table_refs":["p6-table-2","p8-table-1"],"asset_candidates":[],"visual_intent":"source_table","visual_plan":{"layout_family":"matrix","primary_visual":null,"image_budget":0,"image_roles":[],"data_strategy":"native_table","background_variant":"light","density":"dense"},"speaker_notes":{"talk_track":"承接上一页的性能敏感性分析，这一页把“更高效”落到运行时间：实际选并行路径时，先看 actor，再看 rollout/generate。8 卡表显示，RLinf colocated 为 49.15/170.34 秒，两个指标都低于 SimpleVLA 的 94.05/189.33 秒；但 disaggregated 的 rollout 达 546.64 秒，Hybrid 也明显更高。再看 1、2、4 节点数据，模式与规模都会改变成本，因此这里的优势只属于给定任务、硬件和测量口径，不能概括成 RLinf 在所有配置下都更快。下一页将把性能、效率与归因边界合并起来回答开场问题。","delivery_cue":"先停在 49.15/170.34 与 94.05/189.33 的对照，再指向 disaggregated 的 546.64 秒，最后强调节点规模与模式带来的边界。","source_refs":["p6-table-2-crop","p8-table-1-crop","p6-table-2","p8-table-1"],"estimated_seconds":100},"content":{"eyebrow":null,"title":"8 卡上，colocated 同时降低 actor 与 rollout；其余模式的成本随部署方式变化","subtitle":null,"kicker":null,"lede":"选型不能只问“RLinf 快不快”，要同时看 actor、rollout/generate 和节点规模。","note":null,"body_points":[{"label":"8 卡对比","text":"colocated 的 actor 与 rollout 都低于 SimpleVLA；Hybrid 保持较低 actor，但 rollout 高于 colocated。"},{"label":"规模边界","text":"1/2/4 节点下，各模式的 actor 与 generate 随规模变化，效率结论必须绑定具体配置。"}],"metrics":[{"label":"Colocated actor","value":"49.15 s","meaning":"低于 SimpleVLA 的 94.05 s"},{"label":"Colocated rollout","value":"170.34 s","meaning":"低于 SimpleVLA 的 189.33 s"},{"label":"Disaggregated rollout","value":"546.64 s","meaning":"同为 8 卡，但 rollout 成本显著更高"}],"steps":[],"result":null,"columns":[],"takeaway":{"label":"选型结论","value":"在当前 8 卡条件下优先考察 colocated；其他模式需结合节点规模与部署约束重新权衡。"}}}