{"id":"s6","layout":"comparison","composition_id":"argument-pair","role":"method_overview","content_priority":"core","action_title":"RLinf 的平均 RL 增幅更大，但这仍是系统级比较","audience_question":"RLinf 的 RL 增益是否超过 SimpleVLA？","narrative_job":"直接比较两套框架的 SFT→RL 平均变化，并把结论绑定到前一页已经标出的实现差异。","slide_goal":"给出框架级性能判断，同时主动收紧因果措辞。","primary_claim":"RLinf 的平均 SSR 从 24.48% 升至 84.63%，增益为 60.15%；SimpleVLA 从 34.40% 升至 72.18%，增益为 37.78%，因此 RLinf 的平均 RL 增幅更大。","evidence":[{"claim_support":"平均 SSR 对比表同时给出 RLinf SFT/RL、Simple SFT/RL 及两者的 Δ Avg.。","evidence_ref":"p6-table-1","interpretation":"比较 SFT→RL 的变化比只比较最终 SSR 更能回答“RL 带来多少增益”。"},{"claim_support":"任务级表同时展示两套方法的初始 SSR、最终 SSR 和训练步数。","evidence_ref":"p5-table-1","interpretation":"平均差异来自一组任务级结果，但初始能力与训练步数并不完全一致。"}],"implication":"最稳妥的表述是“RLinf 完整训练系统带来更大的平均提升”；若要拆分精度、学习率、reward 或采样策略的单独贡献，还需要额外控制变量或消融。","transition_in":"跨任务结果证明 RLinf 有效，平均对照显示其系统增幅更大。","transition_out":"但平均数仍可能掩盖评估温度和初始模型能力造成的变化，因此要检查结果边界。","evidence_refs":["p6-table-1","p5-table-1"],"table_refs":["p6-table-1","p5-table-1"],"asset_candidates":[],"visual_intent":"comparison_matrix","visual_plan":{"layout_family":"comparison","primary_visual":null,"image_budget":0,"image_roles":[],"data_strategy":"native_table","background_variant":"light","density":"balanced"},"speaker_notes":{"talk_track":"承接上一页的跨任务结果，这里把 SFT→RL 的平均变化直接放在同一张表里比较。RLinf 从24.48%提升到84.63%，平均增加60.15个百分点；SimpleVLA从34.40%提升到72.18%，增加37.78个百分点，所以就完整训练系统的平均增幅而言，RLinf更大。需要注意，任务级表中的初始SSR与训练步数并不一致，且两套框架在精度、valid traj收集和reward设计上存在差异。因此，这一页支持的是系统级判断，不是某个实现因素的单独因果结论。下一页继续检查这个结论的适用边界。","delivery_cue":"先停在两组 Δ Avg. 上，明确强调“60.15% 对 37.78%”；随后指向任务级表中的初始 SSR 与 train step，最后压低因果语气并过渡到结果边界。","source_refs":["p6-table-1","p5-table-1"],"estimated_seconds":100},"content":{"eyebrow":null,"title":"RLinf 的平均 SSR 从 24.48% 升至 84.63%，增益为 60.15%；SimpleVLA 从 34.40% 升至 72.18%，增益为 37.78%，因此 RLinf 的平均 RL 增幅更大。","subtitle":null,"kicker":null,"lede":"把“最终 SSR 更高”改写成更有解释力的问题：SFT 之后，哪套完整训练系统带来了更大的平均提升？","note":{"label":"结论边界","value":"支持系统级比较；不等同于单独归因于精度、学习率、reward 或采样策略。"},"body_points":[{"label":"先看变化量","text":"SFT→RL 的平均增益比最终 SSR 更能回答“RL 带来多少提升”。"},{"label":"再看可比性","text":"任务级结果的初始 SSR 与训练步数不完全一致，且两套框架存在多项实现差异。"},{"label":"因此","text":"RLinf 的完整训练系统平均提升更大，但单因素因果仍需控制变量或消融。"}],"metrics":[{"label":"RLinf Δ Avg.","value":"+60.15%","meaning":"24.48% → 84.63%，平均提升更大"},{"label":"SimpleVLA Δ Avg.","value":"+37.78%","meaning":"34.40% → 72.18%，作为系统级对照"}],"steps":[],"result":null,"columns":[{"label":"RLinf","headline":"24.48% → 84.63%","points":["平均提升 +60.15 个百分点","任务级差异仍受初始 SSR 与训练步数影响"],"tone":"accent"},{"label":"SimpleVLA","headline":"34.40% → 72.18%","points":["平均提升 +37.78 个百分点","作为完整系统对照，而非单变量基线"],"tone":"neutral"}],"takeaway":{"label":"一句话判断","value":"RLinf 的平均 RL 增幅更大，但证据指向的是系统级效果，而不是某个实现因素的独立贡献。"}}}