{"id":"s1","layout":"title","composition_id":"thesis-stage","role":"title","content_priority":"context","action_title":"先问清：RLinf 的提升究竟属于 RL，还是属于完整系统？","audience_question":"这组实验最终要让我判断什么？","narrative_job":"提出唯一主问题：如何在性能增益与归因边界之间做出严谨判断。","slide_goal":"让观众带着明确的归因问题进入实验契约、结果和系统效率证据。","primary_claim":"RLinf 的实验结论必须同时回答性能是否提升、运行是否有效率，以及提升能否被归因于 RL 信号本身。","evidence":[],"implication":"后续每页都围绕可比性、跨任务增益、系统成本和外推边界展开。","transition_in":"从观众熟悉的“看最终 SSR”切入，提出更严格的归因问题。","transition_out":"要判断增益属于什么，先必须固定实验在什么条件下发生。","evidence_refs":[],"table_refs":[],"asset_candidates":[],"visual_intent":"text_led","visual_plan":{"layout_family":"title","primary_visual":null,"image_budget":0,"image_roles":[],"data_strategy":"none","background_variant":"quiet","density":"sparse"},"speaker_notes":{"talk_track":"从观众熟悉的“看最终 SSR”切入，提出更严格的归因问题。 这一页要回答：这组实验最终要让我判断什么？ 核心判断是：RLinf 的实验结论必须同时回答性能是否提升、运行是否有效率，以及提升能否被归因于 RL 信号本身。 这里先建立判断框架，随后用原始证据验证。 这意味着：后续每页都围绕可比性、跨任务增益、系统成本和外推边界展开。 要判断增益属于什么，先必须固定实验在什么条件下发生。","delivery_cue":"先讲结论，再指向证据，最后说清边界并自然过渡。","source_refs":[],"estimated_seconds":65},"content":{"eyebrow":null,"title":"RLinf 的实验结论必须同时回答性能是否提升、运行是否有效率，以及提升能否被归因于 RL 信号本身。","subtitle":"不是只看最终 SSR，而是同时审查性能、效率与归因边界。","kicker":null,"lede":null,"note":{"label":"判断框架","value":"性能提升 ≠ RL 单独贡献"},"body_points":[],"metrics":[],"steps":[],"result":null,"columns":[],"takeaway":null}}