{"id":"s9","layout":"insight","composition_id":"answer-and-boundary","role":"limitations","content_priority":"core","action_title":"应相信 RLinf 的受控系统增益，不应宣称无条件的纯算法优越性","audience_question":"我现在应该相信什么，又必须保留什么？","narrative_job":"直接回答开场归因问题，综合跨任务性能、系统效率和实现边界，给出可引用的最终判断。","slide_goal":"让研究者带走一个强但不越界的结论与复现实验要求。","primary_claim":"在固定 RoboTwin seed、OOD 评估口径和 8 卡 A800 条件下，RLinf 的 RL 训练在 8 个任务上将平均 train SSR 从 24.48% 提升到 84.63%，并在 colocated 配置下表现出有竞争力的 actor/rollout 时间；但精度、超参数、轨迹收集和 reward 设计差异使其不能被表述为纯算法因果结论。","evidence":[{"claim_support":"RLinf 平均 train SSR 为 24.48%→84.63%，SimpleVLA 为 34.40%→72.18%。","evidence_ref":"p6-table-1","interpretation":"性能证据支持 RLinf 完整训练系统在这组任务上的较大平均增益。"},{"claim_support":"8 卡 colocated 的 RLinf actor/rollout 为 49.15/170.34 秒，SimpleVLA 为 94.05/189.33 秒。","evidence_ref":"p6-table-2-crop","interpretation":"效率证据支持特定并行配置下的运行优势，但不代表所有模式和规模都相同。"},{"claim_support":"RLinf 与 SimpleVLA 在精度、超参数、valid trajectory 收集和 reward 设计上存在差异。","evidence_ref":"p4-table-1-crop","interpretation":"这些差异决定了结论应归因于完整训练系统，而不是单独归因于 RLinf 的某一个算法组件。"}],"implication":"复现或引用时至少同时报告训练/评估 seed、GPU、评估温度、训练步数、reward 与轨迹收集策略、精度和并行模式。","transition_in":"系统效率补全了“更快”的证据，且所有结果都已绑定到实验契约。","transition_out":"开场问题的答案是：受控条件下 RLinf 系统确实更强且具有效率优势，但其纯算法归因仍需额外控制变量。","evidence_refs":["p6-table-1","p6-table-2-crop","p4-table-1-crop"],"table_refs":["p6-table-1","p6-table-2","p4-table-1"],"asset_candidates":[],"visual_intent":"text_led","visual_plan":{"layout_family":"insight","primary_visual":null,"image_budget":0,"image_roles":[],"data_strategy":"none","background_variant":"quiet","density":"sparse"},"speaker_notes":{"talk_track":"承接上一页的系统效率结果，这一页把“更强、更快”放回实验契约中判断。固定 RoboTwin seed、OOD 评估口径和 8 卡 A800 后，RLinf 在 8 个任务上的平均 train SSR 从 24.48% 提升到 84.63%，colocated 下 actor 和 rollout 也具竞争力。但两边在精度、学习率、LoRA、轨迹收集和 reward 设计上并不完全一致，因此结论应归因于完整训练系统，而非单一算法组件。复现时需完整报告这些控制变量。","delivery_cue":"先停顿强调“可信的增益”，再指向两个数字对比；最后压低语速读出“系统结论，不是纯算法因果”，并过渡到复现要求。","source_refs":["p6-table-1","p6-table-2-crop","p4-table-1-crop","p6-table-2","p4-table-1"],"estimated_seconds":100},"content":{"eyebrow":null,"title":"可信的是受控系统增益，尚未证明的是纯算法优越性","subtitle":null,"kicker":null,"lede":"在固定 RoboTwin seed、OOD 评估口径与 8 卡 A800 条件下，RLinf 的完整 RL 训练系统更强且更具效率优势；但跨实现差异限制了纯算法归因。","note":{"label":"引用边界","value":"报告结果时，同时给出 seed、GPU、温度、步数、reward、轨迹收集、精度与并行模式。"},"body_points":[{"label":"性能：可相信","text":"8 个任务平均 train SSR：RLinf RL 84.63%，由 SFT 的 24.48% 提升；SimpleVLA RL 为 72.18%。"},{"label":"效率：有条件成立","text":"8 卡 colocated 下，RLinf actor/rollout 为 49.15/170.34 秒，优于 SimpleVLA 的 94.05/189.33 秒。"},{"label":"归因：必须保留边界","text":"精度、学习率、LoRA、valid trajectory 收集与 reward 设计不同，不能把增益单独归因于某个算法组件。"}],"metrics":[{"label":"平均 train SSR","value":"24.48% → 84.63%","meaning":"RLinf 完整训练系统在 8 个任务上的平均提升"},{"label":"colocated actor","value":"49.15 s","meaning":"8 卡条件下，低于 SimpleVLA 的 94.05 s"},{"label":"colocated rollout","value":"170.34 s","meaning":"8 卡条件下，低于 SimpleVLA 的 189.33 s"}],"steps":[],"result":null,"columns":[],"takeaway":{"label":"最终判断","value":"受控条件下 RLinf 系统确实更强且具有效率优势；纯算法因果仍需额外控制变量。"}}}