{"id":"s5","layout":"chart-focus","composition_id":"chart-with-interpretation-rail","role":"main_results","content_priority":"core","action_title":"RLinf 在 8 个任务上都提升，平均 train SSR 从 24.48% 到 84.63%","audience_question":"RLinf 的 RL 增益是单个任务的偶然现象吗？","narrative_job":"用任务级结果和平均值突出 RLinf SFT→RL 的跨任务提升，同时保留任务间幅度与训练步数差异。","slide_goal":"建立最强的单系统性能证据。","primary_claim":"8 个 RoboTwin 任务的 RLinf RL train SSR 均高于 RLinf SFT，平均值从 24.48% 提升到 84.63%，平均提升为 60.15%。","evidence":[{"claim_support":"8 个任务分别列出 RLinf SFT、RLinf RL、平均提升和训练步数，所有任务的 RLinf RL 数值高于对应 SFT 数值。","evidence_ref":"p5-table-1","interpretation":"提升跨越不同任务，但幅度和所需训练步数不同；低初始 SSR 任务并不等于低最终 SSR，却可能需要更多训练。"},{"claim_support":"平均汇总为 RLinf SFT 24.48%、RLinf RL 84.63%，Δ Avg. 为 +60.15%。","evidence_ref":"p6-table-1","interpretation":"平均值支持 RLinf 在这组任务上的总体训练收益，但仍需连同训练配置与评估口径解释。"}],"implication":"跨任务结果支持“RLinf 的 RL 训练有效”，但还没有回答这是否优于另一套实现或是否是纯 RL 信号造成的。","transition_in":"比较口径已被标注，先检验 RLinf 自身是否稳定地产生收益。","transition_out":"下一步把相同的 SFT→RL 变化与 SimpleVLA 并置，判断系统级增益是否更大。","evidence_refs":["p5-table-1","p6-table-1"],"table_refs":["p5-table-1","p6-table-1"],"asset_candidates":[],"visual_intent":"data_chart","visual_plan":{"layout_family":"chart-focus","primary_visual":null,"image_budget":0,"image_roles":[],"data_strategy":"native_chart","background_variant":"light","density":"balanced"},"speaker_notes":{"talk_track":"承接上一页的比较口径，这里先看 RLinf 自身的跨任务稳定性。结论不是某一个任务偶然变好：8 个 RoboTwin 任务里，RLinf RL 的 train SSR 全部高于 SFT，平均从 24.48% 升到 84.63%，提升 60.15%。任务级结果同时显示，增益幅度从 18.75 到 85.94 不等，训练步数也从 30 到 240；因此低初始 SSR 可能需要更多训练，但不决定最终上限。边界是这还不能证明优于 SimpleVLA 或完全归因于 RL，下一页继续做并置比较。","delivery_cue":"先停在 24.48%→84.63% 的平均变化，再指向任务级柱状结果，强调“8/8 提升”与训练步数差异，最后明确归因边界。","source_refs":["p5-table-1","p6-table-1"],"estimated_seconds":100},"content":{"eyebrow":null,"title":"8 个 RoboTwin 任务的 RLinf RL train SSR 均高于 RLinf SFT，平均值从 24.48% 提升到 84.63%，平均提升为 60.15%。","subtitle":null,"kicker":null,"lede":"任务级结果显示，RLinf 的 RL 增益不是单个任务的偶然现象：8/8 任务均实现提升，但提升幅度与训练步数存在明显差异。","note":null,"body_points":[{"label":"跨任务一致性","text":"8/8 个任务的 RLinf RL train SSR 均高于对应 SFT，支持“RL 训练有效”的总体判断。"},{"label":"增益幅度有差异","text":"平均提升从 18.75 到 85.94 不等；低初始 SSR 任务并不等于低最终 SSR。"},{"label":"训练成本需同时看","text":"RLinf train step 覆盖 30–240，结果强度不能脱离训练步数与配置口径解读。"}],"metrics":[{"label":"RLinf SFT 平均 train SSR","value":"24.48%","meaning":"RL 训练前的跨任务平均起点"},{"label":"RLinf RL 平均 train SSR","value":"84.63%","meaning":"RL 训练后的跨任务平均结果"},{"label":"平均提升","value":"+60.15%","meaning":"8 个任务汇总的总体训练收益"}],"steps":[],"result":null,"columns":[],"takeaway":null}}