{"id":"s3","layout":"pipeline","composition_id":"causal-flow","role":"method_detail","content_priority":"core","action_title":"RLinf 把 1024 条 rollout 组织成 action-level reward，再做 GRPO 更新","audience_question":"RLinf 的训练信号究竟如何产生？","narrative_job":"用单一有序链条解释 rollout、valid trajectory、action-level reward、GRPO 优势估计和 LoRA 更新之间的关系。","slide_goal":"让观众知道结果背后的训练配方，而不是把“使用 GRPO”当成完整解释。","primary_claim":"RLinf 的配置将 128×8 的 rollout 组织为 global batch size 1024，使用 group size 8、action-level reward、token-level logprob/entropy、GRPO 和 LoRA 更新。","evidence":[{"claim_support":"配置给出 rollout batch 128×8=1024、global batch size 1024、group_size 8、rollout_epoch 8、reward_type action_level、logprob_type token_level、adv_type grpo、is_lora true 和 learning rate 2.0e-4。","evidence_ref":"p3-snapshot","interpretation":"这些配置决定每次更新看到多少轨迹、奖励落在哪个动作粒度，以及模型以何种参数范围被更新。"}],"implication":"后续性能结果应归因于这套完整的 rollout、reward、优化和参数更新路径，而不应只归因于算法名称。","transition_in":"实验契约说明了测什么，训练配置说明了 RLinf 如何学习。","transition_out":"接下来必须检查这套路径与 SimpleVLA 是否真的只差一个框架名称。","evidence_refs":["p3-snapshot"],"table_refs":[],"asset_candidates":[],"visual_intent":"method_diagram","visual_plan":{"layout_family":"pipeline","primary_visual":null,"image_budget":0,"image_roles":[],"data_strategy":"diagram","background_variant":"default","density":"balanced"},"speaker_notes":{"talk_track":"承接上一页，实验契约只说明评价什么，这一页补上 RLinf 如何学习。一次更新先按 128×8 组织出 1024 条 rollout，并以 group size 8 形成比较单元；奖励落在 action level，logprob 与 entropy 保持 token level，再用 GRPO 计算优势并进行 actor 更新。最后通过 LoRA 和 2.0e-4 学习率限定更新方式。这里的边界是：配置能说明训练配方，但还不能证明它与 SimpleVLA 只差框架名称，下一页继续核对两者差异。","delivery_cue":"先指向 1024 与 group size 8，再沿箭头移动到 action-level reward、GRPO，最后停在 LoRA 更新上，强调“完整路径”而非单一算法名。","source_refs":["p3-snapshot"],"estimated_seconds":100},"content":{"eyebrow":null,"title":"RLinf 把 1024 条 rollout 组织成 action-level reward，再做 GRPO 更新","subtitle":null,"kicker":null,"lede":"训练信号不是“用了 GRPO”这么简单，而是由采样规模、奖励粒度、优势估计和参数更新共同决定。","note":null,"body_points":[{"label":"规模先定下来","text":"128 × 8 rollout = global batch size 1024；group size 8 让轨迹按组进入优势估计。"},{"label":"信号再逐层变换","text":"奖励落在 action level，logprob / entropy 保持 token level，最后用 GRPO 驱动 actor 的 LoRA 更新。"}],"metrics":[{"label":"每轮 rollout","value":"128 × 8","meaning":"一次更新组织 1024 条轨迹"},{"label":"奖励粒度","value":"action-level","meaning":"奖励绑定到动作，而不是整条轨迹的单一 token 信号"},{"label":"更新方式","value":"GRPO + LoRA","meaning":"用组内优势估计驱动参数高效更新"}],"steps":[{"title":"Rollout 采样","text":"并行生成一轮轨迹，形成固定规模的训练输入。","metric":"128 × 8 = 1024","tone":"navy"},{"title":"Group 组织","text":"按 group size 8 将轨迹组成比较单元，为组内优势估计准备数据。","metric":"group size = 8","tone":"blue"},{"title":"Action-level reward","text":"把任务反馈落到动作粒度，明确奖励在行为序列中的位置。","metric":"reward_type = action_level","tone":"coral"},{"title":"GRPO 优势估计","text":"结合 token-level logprob / entropy，计算用于 actor 更新的优势信号。","metric":"adv_type = grpo","tone":"blue"},{"title":"LoRA 更新","text":"在参数高效更新范围内完成策略优化，而非全参数更新。","metric":"is_lora = true · lr = 2.0e-4","tone":"navy"}],"result":{"label":"训练配方的含义","value":"性能归因应落在 rollout、reward、优化与参数更新的完整路径上"},"columns":[],"takeaway":null}}